url,data
http://serinusenergy.com/news/,filesemptysearchcalendarfilepdfrssxhtml 44 204 541 7860 AIMSENX 306p    WSESEN PLN 071    English polski About Company Overview Policies and Guidelines Corporate Strategy Directors Management Operations Romania Tunisia Investors Overview Financial Results AIM Rule 26 Presentations Investor Contact News WSE Current Report Filings Events Contact ESG ESG Introduction ESG Committee Environment Social Governance Search for News 2024 2023 2022 2021 2020 2019 H1 2024 Interim Financial Results 08122024 Jersey Channel Islands 12 August 2024  Serinus Energy plc Serinus or the Company or the Group AIMSENX WSESEN is  H1 2024 Results Investor Presentation 08052024 Jersey Channel Islands 05 August 2024  Serinus Energy plc Serinus or the Company AIMSENX WSESEN is pleased to announce  Director Resignation 07022024 Jersey Channel Islands 02 July 2024  Serinus Energy plc the Company announces that Mr Jonathan Kempster has resigned as  Issue of Equity under 2023 LTIP  Total Voting Rights 06272024 Jersey Channel Islands 27 June 2024  Serinus Energy plc the Company reports that on 26 June 2023 Vlad Ryabov  DirectorPDMR Shareholdings 06062024 Jersey Channel Islands 06 June 2024  Serinus Energy plc the Company reports that its Chief Executive Officer Jeffrey Auld  DirectorPDMR Exercise of Options 06042024 Jersey Channel Islands 04 June 2024  Serinus Energy plc the Company reports that its Chief Executive Officer Jeffrey Auld  Q1 2024 Interim Financial Results 05132024 Jersey Channel Islands 13 May 2024  Serinus Energy plc Serinus or the Company or the Group AIMSENX WSESEN is  Voting Results from AGM 05102024 Jersey Channel Islands 10 May 2024  Serinus Energy plc Serinus or the Company AIMSENX WSESEN reports that at the  Q1 2024 Results Investor Presentation 05072024 Jersey Channel Islands 07 May 2024  Serinus Energy plc Serinus or the Company AIMSENX WSESEN is pleased to announceread  Notice of Annual General Meeting 04182024 Jersey Channel Islands 18 April 2024  Serinus Energy plc Serinus SEN or the Company AIMSENX WSESEN announces that a  Annual Financial Results for 2023 03182024 Jersey Channel Islands 18 March 2024  Serinus Energy plc Serinus or the Company or the Group AIMSENX WSESEN is  2023 Annual Results Investor Presentation 03112024 Jersey Channel Islands 11 March 2024  Serinus Energy plc Serinus or the Company AIMSENX WSESEN is pleased to announce  Participation in Onshore Angola Licence Round 01232024 Jersey Channel Islands 23 January 2024  Serinus Energy plc Serinus or the Company AIMSENX WSESEN notes that it has  Investors Overview Financial Results AIM Rule 26 Presentations Investor Contact News WSE Current Report Filings Events A 2nd Floor The Le Gallais Building 54 Bath Street StHelier Jersey JE1 1FW T 44 204 541 7860 F 44 207 839 8596 Copyright  2024 Serinus Energy Privacy Policy and Terms of Use Website by Zing
https://mol.hu/en/about-mol/media-room/press-releases,Were sorry but MOL doesnt work properly without JavaScript enabled Please enable it to continue
http://www.psa.no/?lang=en_US,Til toppen Hopp til hovedinnhold Regelverk Tilsyn English Lukk søk Hva leter du etter Regelverk Tilsynsrapporter og granskinger Fagstoff Lukk meny English Regelverk Alle forskrifter Lover Endringer og høringer PDF av regelverket Eldre forskrifter Regelverk Alle forskrifter Lover Endringer og høringer PDF av regelverket Eldre forskrifter Tilsyn Tilsynsrapporter Granskingsrapporter Samtykker Samsvarsuttalelser SUT Meldingar om pålegg Tilsyn Tilsynsrapporter Granskingsrapporter Samtykker Samsvarsuttalelser SUT Meldingar om pålegg Tema og fagstoff Alle tema Risikonivå RNNP Ord og uttrykk Hovedtema 2024 Ikke glem arbeidsmiljøet Tema og fagstoff Alle tema Risikonivå RNNP Ord og uttrykk Hovedtema 2024 Ikke glem arbeidsmiljøet Arrangementer Arrangementer Tidligere arrangementer Arrangementer Arrangementer Tidligere arrangementer Trepartssamarbeid Trepartssamarbeid Ansvarsfordeling Sikkerhetsforum Regelverksforum Trepartssamarbeid Trepartssamarbeid Ansvarsfordeling Sikkerhetsforum Regelverksforum Om oss Rolle og ansvarsområde Organisasjon QA Forstå det norske regimet Internasjonalt samarbeid Ledige stillinger Om oss Rolle og ansvarsområde Organisasjon QA Forstå det norske regimet Internasjonalt samarbeid Ledige stillinger Kontakt oss Kontaktpersoner Innrapportering til Havtil Søk om innsyn Varsle oss Kontakt oss Kontaktpersoner Innrapportering til Havtil Søk om innsyn Varsle oss Regelverk Tilsyn Havtil  Forside Det var ein gong Forteljinga om sikkerheitsutviklinga på norsk sokkel er eit viktig stykke noregshistorie Oppturar og nedturar jubel og katastrofe tøffe tak og teknologisk utvikling har prega historia No går vi inn i ein ny fase der nye industriar kjem til Arrangementer 30 okt Topplederkonferansen 2024 05 des Det handler om arbeidet  Fagdag om organisatorisk og psykososialt arbeidsmiljø 2024 Se nye og tidligere arrangementer Havtil  Forside Aktuelle saker Pålegg til Equinor  Hammerfest LNG  materialhåndtering og arbeid i høyden Publisert 24 oktober 2024 Kran og løft Fiks arbeidsplassen  ikke arbeidstakeren Publisert 30 september 2024 Arbeidsmiljø Ny podkast Trusselvurderingen åpenhetskultur og sikkerhet Publisert 20 september 2024 Havtil Sikring Nytt energieventyr i havet Publisert 18 september 2024 I over 50 år har Noreg vore ein leiande nasjon innan energiproduksjon til havs Med ambisiøse planar om storskala utbygging av vindkraft i havet kan havvind bli ein spennande ny fase Men overgangen til fornybar energi byr òg på unike utfordringar Havvind Siste tilsynsrapportar Pålegg til Equinor  Hammerfest LNG  materialhåndtering og arbeid i høyden Publisert 24 oktober 2024 Macro Offshore  Haven  SUTtilsyn  vedlikeholdsstyring Publisert 8 oktober 2024 Westcon løfteteknikk  oppfølging av sakkyndig virksomhet Publisert 8 oktober 2024 Sjå alle tilsynsrapportar Siste granskingsrapportar Equinor  Mongstad  gransking av kortslutning og brann Publisert 23 september 2024 Pålegg til Okea etter gransking av hendelse med personskade på Brage Publisert 3 juni 2024 Pålegg til Equinor etter gransking av hendelse med personskade og gasslekkasje på Statfjord B Publisert 15 april 2024 Sjå alle granskingsrapportar Kontakt oss Kontaktpersoner Søk om innsyn Varsle oss Hold deg oppdatert Magasiner og publikasjoner Abonner på nyheter Ledige stillinger Professor Olav Hanssens vei 10Postboks 599 4003 Stavanger Telefon 51 87 32 00Epost postbokshavtilno Faktura ønskes sendt som EHFOrganisasjonsnummer 986 174 613 DroppsonePersonvernerklæringTilgjengelighetserklæring Facebook Linkedin Youtube Instagram Havindustritilsynet  2024
https://www.total.com/en/investors,Main menu Main content Footer Contact Our presence in the world Where results are available use the up and down arrows to navigate the list and use the enter key to make a choice What are you looking for Search English current language en English Choose the interface language EnglishENFrançaisFR Menu Our Company Our identity TotalEnergies at a glance Our history Our governance Our ethics policy Our strength Our employees Research and development Our integrated business model Our geographic roots Our sports partnerships Our ambition Our strategy Our investments Our multienergy offer Lowcarbon electricity Natural gas Petroleum products New lowcarbon energies Projects and achievements Our expertise Explore and produce Oil and gas Renewable energies Bioenergies Transform and develop Electricity Refining and petrochemicals Polymers Ship and market Trading and shipping Products and services Sustainability Our approach Challenges Energy transition Governance Business ethics Advocacy principles Reports and indicators CSR reports and reporting standards Vigilance plan Indicators ESG ratings BREAK N2 Energy and climate Acting on our direct emissions Improving our products and supporting our customers Environment Biodiversity Water Air Soil Circular economy Sustainability and Climate 2024 Progress Report BREAK Peoples safety respect and wellbeing Health and safety Responsible employer Positive impact for stakeholders Human rights Stakeholder relationships Local economic development Sustainable procurement Access to energy TotalEnergies Foundation Investors Careers Join us Our latest job offers Our opportunities for young people BREAK N2 Find out about our jobs Find your own path Support our transformation BREAK N2 Come and work with us Get ahead in your career Enjoy the benefits of a great place to work Benefit from an attractive package Apply now News News Press releases BREAK N2 Publications BREAK N2 Calendar Contact the press office Clients websites Contact Our presence in the world Where results are available use the up and down arrows to navigate the list and use the enter key to make a choice What are you looking for Search English current language en English Choose the interface language EnglishENFrançaisFR Breadcrumb Home See sibling pages of Investors Our CompanySustainabilityCareersNewsClients websites Investors Investors Third Quarter 2024 Results Presentation Thursday October 31 2024 from 1100 am to 1230 pm London time Learn more Results and reportsFind our results and reports on these pagesResults Reports Indicators Press releases and financial calendarPress releasesCalendar Investor presentations All our investor presentations are available on this page Investor presentations Shares and dividends All useful information for shareholders investors analysts etc DividendsShares Annual Shareholders meeting A landmark moment of shareholder democracy Shareholders meeting Individual shareholders Our shareholders play a key role in growing our business Individual shareholders ESGHubTo be a major player in the energy transition ESG Bonds All useful information for bondholders Bonds Regulated information TotalEnergies SE makes available regulated information Regulated information Investors contacts We strive to develop a longterm and sustainable relationship with you Contact us Contact Suppliers General Terms and Conditions of Use Personal data charter cookies and tracers Accessibility  partially compliant Sitemap  2024 TotalEnergies Follow us
https://www.akerbp.com/nyheter/,Skip to content Primary Menu Om oss Hvem er vi Styret Hovedledelsen Nøkkelinformasjon Verdier Etikk Strategi Allianser Vår virksomhet Våre felt Våre prosjekter Leting Lisenser Konsekvensutredninger Program for konsekvensutredninger Bærekraft Vår tilnærming til bærekraft Menneskerettigheter Klima Miljøpåvirkning Sikker drift Beredskap Bærekraftsrapporter Digital Investor Hvorfor investere Rapporter og presentasjoner Aksjen Nyheter Operasjonell info Analytisk info Gjeldsinformasjon Selskapsstyring Dekarbonisering Finansiell kalender IR i Aker BP Leverandører Hvordan bli leverandør Forventninger til leverandører Viktig informasjon før utreise Forretningsvilkår Varelevering Registrering av midlertidig utstyr Adresser og kontaktinformasjon Fakturering Kontakt oss om faktura Karriere Erfaren Studenter og nyutdannede Møt oss her Lærlinger Ledige stillinger Nyheter Pressemeldinger Historier Kontakt Aker BP 22920 Tid 163000 Change 060 026   2024 Euronext NV All Rights Reserved The information data analysis and information contained herein 1 include the proprietary information of Euronext and its content providers 2 may not be copied or further disseminated by and media whatsoever except as specifically authorized by Euronext 3 do not constitute investment advice 4 are provided solely for informational purposes and 5 are not warranted to be complete accurate or timely Oljepris 7455 Brent Oil price Etiske retningslinjer Policy hub Varsling Beredskapshendelse Retningslinje for personvern Arkiv Pressemeldinger Historier Pressemelding Aker BP completes annual employee share programme Reference is made to Aker BPs announcement on 23 September 2024 regarding the companys annual share purchase programme for employees The programme has now been completed with a total of 1271447 shares sold to employees at a price of NOK 18287 per share This price reflects a 20 percent 23102024 Pressemelding Aker BP Third quarter 2024 trading update Aker BP OSE AKRBP will publish its report for the third quarter of 2024 on Wednesday 30 October 2024 Today the company provides preliminary production and sales figures for the quarter Production and sales The companys equity production for the quarter averaged 4147 14102024 Pressemelding Aker BP ASA announces completion of Senior Notes Offering Aker BP ASA the Company is pleased to announce that it has successfully completed its senior notes offering the Offering of i 750 million aggregate principal amount of 5125 Senior Notes due 2034 the 2034 Notes and ii 750 million aggregate principal amount of its 02102024 Pressemelding Notification of acquisition of own shares Reference is made to Aker BPs press release from 4 June 2024 where the company announced its plan to buy up to 1000000 own shares in connection with the companys employee share saving plan In the period from 24 September to 25 September the company purchased 100000 shares at an average 26092024 Pressemelding Aker BP ASA announces pricing of Senior Notes Offering Aker BP ASA the Company is pleased to announce that it has priced its offering the Offering of i 750 million aggregate principal amount of 5125 Senior Notes due 2034 the 2034 Notes at a price equal to 99683 of the aggregate principal amount 24092024 Pressemelding AKER BP ASA ANNOUNCES LAUNCH OF OFFERING OF US DOLLARDENOMINATED SENIOR NOTES Lysaker 24 September 2024 Aker BP ASA the Company announced today that it has launched a multitranche offering the Offering of US Dollardenominated Rule 144ARegulation S senior unsecured notes the Notes The interest rate offering price and certain other terms will be 24092024 Pressemelding Aker BP ASA to hold fixed income investor meetings Aker BP ASA the Company today announced that a series of fixed income investor calls has been arranged A multitranche US dollardenominated benchmark Rule 144A  Reg S senior unsecured notes offering may follow subject to market conditions The purpose of the contemplated notes 23092024 Pressemelding Employees buy shares in Aker BP Aker BP has received subscriptions from employees for more than 12 million shares at a discounted price of NOK 18287 per share through the companys annual share purchase programme The subscription price represents a 20 percent discount to the reference market price and the shares are 23092024 Keynote speech at the Pareto Securities Energy Conference 11092024 Pressemelding Tyrving i produksjon 03092024 Pressemelding Tyrving on stream 03092024 Pressemelding Grants awarded under Aker BPs LongTerm Incentive Programme Aker BPs LongTerm Incentive Programme LTIP is designed to incentivise the executive management team EMT to deliver on the companys longterm business objectives and maximise alignment with shareholder value creation The LTIP is a sharebased scheme in which grants are awarded annually 02092024 1 2 3  107 Aker BP Aker BP er et oljeselskap som leter utvikler felt og produserer olje og gass på den norske kontinentalsokkelen Selskapet er operatør for seks feltsenter Alvheim Ivar Aasen Skarv Edvard Grieg Ula og Valhall og medeier i Johan Sverdrupfeltet Målt i produksjon er Aker BP et av de største uavhengige børsnoterte oljeselskapene i Europa Abonner på pressemeldingertjenesten er levert av Cision Epost Send Postadresse Aker BP ASA PO Box 65 NO1324 Lysaker Besøksadresse Oksenøyveien 10 NO1366 Lysaker Kontakt  Aker BP 2024 Design og utvikling av Headspin
https://www.petoro.no/publisert/pressemeldinger,eng ResultaterOm PetoroOrganisasjonHovedoppgaverSDØEfaktaVisjon strategi og verdierEierstyring ledelseProtokoller fra generalforsamlinger Petoro ASEtiske retningslinjerSamfunnsansvarEtablering av SDØE og PetoroVedtekterBærekraftNyheterMediaKarriereKontaktResultaterOm PetoroOrganisasjonHovedoppgaverSDØEfaktaVisjon strategi og verdierEierstyring ledelseProtokoller fra generalforsamlinger Petoro ASEtiske retningslinjerSamfunnsansvarEtablering av SDØE og PetoroVedtekterBærekraftNyheterMediaKarriereKontaktResultaterPetoro publiserer Ãrs og kvartalsrapporter for virksomheten Her finner du rapporter fra styret og pressemeldinger med presentasjoner fra pressekonferanser NÃkkeltall 2023KontantstrÃm Investeringer Produksjon HMS resultat Last ned pdfPetoro_Kvartalsrapport_Q22024Kvartalsrapporter for SDÃE 2024Petoro_Kvartalsrapport_Q22024Petoro_Kvartalsrapport_Q12024Finanskalender 2024Ã rsresultat 2023 1 kvartalsrapport 2024 2 kvartalsrapport 2024 3 kvartalsrapport 2024 Rapporter for SDÃE og Petoro2023Rapporter for SDÃE og Petoro 2023 Årsrapport 2023 Kvartalsrapport 3 kvartal Kvartalsrapport 2 kvartal Kvartalsrapport 1 kvartal SDØEresultater 2023 Resultat SDØE 3 kvartal 2023 Resultat SDØE 2 kvartal 2023 Resultat SDØE 1 kvartal 2023 2022Rapporter for SDÃE og Petoro 2022 Årsrapport 2022 Kvartalsrapport 3 kvartal Kvartalsrapport 2 kvartal Kvartalsrapport 1 kvartal SDØEresultater 2022 Resultat SDØE 3 kvartal 2022 Resultat SDØE 2 kvartal 2022 Resultat SDØE 1 kvartal 2022 2021Rapporter for SDÃE og Petoro 2021 Årsrapport 2021 Kvartalsrapport 3 kvartal Kvartalsrapport 2 kvartal Kvartalsrapport 1 kvartal SDØEresultater 2021 Resultat SDØE 3 kvartal 2021 Resultat SDØE 2 kvartal 2021 Resultat SDØE 1 kvartal 2021 2020Rapporter for SDÃE og Petoro 2020 Årsrapport 2020 Kvartalsrapport 3 kvartal Kvartalsrapport 2 kvartal Kvartalsrapport 1 kvartal SDØEresultater 2020 Resultat SDØE 3 kvartal 2020 Resultat SDØE 2 kvartal 2020 Resultat SDØE 1 kvartal 2020 2019Rapporter for SDÃE og Petoro 2019 Årsrapport 2019 Kvartalsrapport 3 kvartal Kvartalsrapport 2 kvartal Kvartalsrapport 1 kvartal SDØEresultater 2019 Resultat SDØE 3 kvartal 2019 Resultat SDØE 2 kvartal 2019 Resultat SDØE 1 kvartal 2019 2018Rapporter for SDÃE og Petoro 2018 Årsrapport 2018 Kvartalsrapport 3 kvartal Kvartalsrapport 2 kvartal Kvartalsrapport 1 kvartal SDØEresultater 2018 Resultat SDØE 3 kvartal 2018 Resultat SDØE 2 kvartal 2018 Resultat SDØE 1 kvartal 2018 2017Rapporter for SDÃE og Petoro 2017 Årsrapport 2017 Kvartalsrapport 3 kvartal Kvartalsrapport 2 kvartal Kvartalsrapport 1 kvartal SDØEresultater 2017 Pressemelding 3 kvartal 2017 Pressemelding 2 kvartal 2017 Pressemelding 1 kvartal 2017 2016Rapporter for SDÃE og Petoro 2016 Årsrapport 2016 Kvartalsrapport 3 kvartal Kvartalsrapport 2 kvartal Kvartalsrapport 1 kvartal SDØEresultater 2016 Pressemelding 3 kvartal 2016 Pressemelding 2 kvartal 2016 2015Rapporter for SDÃE og Petoro 2015 Årsrapport 2015 Kvartalsrapport 3 kvartal Kvartalsrapport 2 kvartal Kvartalsrapport 1 kvartal SDØEresultater 2015 Pressemelding 3 kvartal 2015 Pressemelding 2 kvartal 2015 Pressemelding 1 kvartal 2015 2014Rapporter for SDÃE og Petoro 2014 Årsrapport 2014 Kvartalsrapport 3 kvartal Kvartalsrapport 2 kvartal Kvartalsrapport 1 kvartal SDØEresultater 2014 Pressemelding 3 kvartal 2014 Pressemelding 2 kvartal 2014 Pressemelding 1 kvartal 2014 2013Rapporter for SDÃE og Petoro 2013 Årsrapport 2013 Kvartalsrapport 3 kvartal Kvartalsrapport 2 kvartal Kvartalsrapport 1 kvartal SDØEresultater 2013 Pressemelding 3 kvartal 2013 Pressemelding 2 kvartal 2013 Pressemelding 1 kvartal 2013 2012Rapporter for SDÃE og Petoro 2012 Årsrapport 2012 Kvartalsrapport 3 kvartal Kvartalsrapport 2 kvartal Kvartalsrapport 1 kvartal SDØEresultater 2012 Pressemelding 3 kvartal 2012 Pressemelding 2 kvartal 2012 Pressemelding 1 kvartal 2012 2011Rapporter for SDÃE og Petoro 2011 Årsrapport 2011 Kvartalsrapport 3 kvartal Kvartalsrapport 2 kvartal Kvartalsrapport 1 kvartal SDØEresultater 2011 Pressemelding 3 kvartal 2011 Pressemelding 2 kvartal 2011 Pressemelding 1 kvartal 2011 2010Rapporter for SDÃE og Petoro 2010 Årsrapport 2010 Kvartalsrapport 3 kvartal Kvartalsrapport 2 kvartal Kvartalsrapport 1 kvartal 2009Rapporter for SDÃE og Petoro 2009 Årsrapport 2009 Kvartalsrapport 3 kvartal Kvartalsrapport 2 kvartal Kvartalsrapport 1 kvartal 2008Rapporter for SDÃE og Petoro 2008 Årsrapport 2008 Kvartalsrapport 3 kvartal Kvartalsrapport 2 kvartal Kvartalsrapport 1 kvartal 2007Rapporter for SDÃE og Petoro 2007 Årsrapport 2007 Kvartalsrapport 3 kvartal Kvartalsrapport 2 kvartal Kvartalsrapport 1 kvartal 2006Rapporter for SDÃE og Petoro 2006 Årsrapport 2006 Kvartalsrapport 3 kvartal Kvartalsrapport 2 kvartal Kvartalsrapport 1 kvartal 2005Rapporter for SDÃE og Petoro 2005 Årsrapport 2005 Kvartalsrapport 3 kvartal Kvartalsrapport 2 kvartal Kvartalsrapport 1 kvartal 2004Rapporter for SDÃE og Petoro 2004 Årsrapport 2004 Kvartalsrapport 3 kvartal Kvartalsrapport 2 kvartal Kvartalsrapport 1 kvartal 2003Rapporter for SDÃE og Petoro 2003 Årsrapport 2003 Kvartalsrapport 3 kvartalâ 2002Rapporter for SDÃE og Petoro 2002 Årsrapport 2002 2001Rapporter for SDÃE og Petoro 2001 Årsrapport 2001 Rapporter 2023 Årsrapport 2023 Kvartalsrapport 3 kvartal Kvartalsrapport 2 kvartal Kvartalsrapport 1 kvartal SDØEresultater 2023 Resultat SDØE 3 kvartal 2023 Resultat SDØE 2 kvartal 2023 Resultat SDØE 1 kvartal 2023 Rapporter 2022 Årsrapport 2022 Kvartalsrapport 3 kvartal Kvartalsrapport 2 kvartal Kvartalsrapport 1 kvartal SDØEresultater 2022 Resultat SDØE 3 kvartal 2022 Resultat SDØE 2 kvartal 2022 Resultat SDØE 1 kvartal 2022 Rapporter 2021 Årsrapport 2021 Kvartalsrapport 3 kvartal Kvartalsrapport 2 kvartal Kvartalsrapport 1 kvartal SDØEresultater 2021 Resultat SDØE 3 kvartal 2021 Resultat SDØE 2 kvartal 2021 Resultat SDØE 1 kvartal 2021 Rapporter 2020 Årsrapport 2020 Kvartalsrapport 3 kvartal Kvartalsrapport 2 kvartal Kvartalsrapport 1 kvartal SDØEresultater 2020 Resultat SDØE 3 kvartal 2020 Resultat SDØE 2 kvartal 2020 Resultat SDØE 1 kvartal 2020 Rapporter 2019 Årsrapport 2019 Kvartalsrapport 3 kvartal Kvartalsrapport 2 kvartal Kvartalsrapport 1 kvartal SDØEresultater 2019 Resultat SDØE 3 kvartal 2019 Resultat SDØE 2 kvartal 2019 Resultat SDØE 1 kvartal 2019 Rapporter 2018 Årsrapport 2018 Kvartalsrapport 3 kvartal Kvartalsrapport 2 kvartal Kvartalsrapport 1 kvartal SDØEresultater 2018 Resultat SDØE 3 kvartal 2018 Resultat SDØE 2 kvartal 2018 Resultat SDØE 1 kvartal 2018 Rapporter 2017 Årsrapport 2017 Kvartalsrapport 3 kvartal Kvartalsrapport 2 kvartal Kvartalsrapport 1 kvartal SDØEresultater 2017 Pressemelding 3 kvartal 2017 Pressemelding 2 kvartal 2017 Pressemelding 1 kvartal 2017 Rapporter 2016 Årsrapport 2016 Kvartalsrapport 3 kvartal Kvartalsrapport 2 kvartal Kvartalsrapport 1 kvartal SDØEresultater 2016 Pressemelding 3 kvartal 2016 Pressemelding 2 kvartal 2016 Rapporter 2015 Årsrapport 2015 Kvartalsrapport 3 kvartal Kvartalsrapport 2 kvartal Kvartalsrapport 1 kvartal SDØEresultater 2015 Pressemelding 3 kvartal 2015 Pressemelding 2 kvartal 2015 Pressemelding 1 kvartal 2015 Rapporter 2014 Årsrapport 2014 Kvartalsrapport 3 kvartal Kvartalsrapport 2 kvartal Kvartalsrapport 1 kvartal SDØEresultater 2014 Pressemelding 3 kvartal 2014 Pressemelding 2 kvartal 2014 Pressemelding 1 kvartal 2014 Rapporter 2013 Årsrapport 2013 Kvartalsrapport 3 kvartal Kvartalsrapport 2 kvartal Kvartalsrapport 1 kvartal SDØEresultater 2013 Pressemelding 3 kvartal 2013 Pressemelding 2 kvartal 2013 Pressemelding 1 kvartal 2013 Rapporter 2012 Årsrapport 2012 Kvartalsrapport 3 kvartal Kvartalsrapport 2 kvartal Kvartalsrapport 1 kvartal SDØEresultater 2012 Pressemelding 3 kvartal 2012 Pressemelding 2 kvartal 2012 Pressemelding 1 kvartal 2012 Rapporter 2011 Årsrapport 2011 Kvartalsrapport 3 kvartal Kvartalsrapport 2 kvartal Kvartalsrapport 1 kvartal SDØEresultater 2011 Pressemelding 3 kvartal 2011 Pressemelding 2 kvartal 2011 Pressemelding 1 kvartal 2011 Rapporter 2010 Årsrapport 2010 Kvartalsrapport 3 kvartal Kvartalsrapport 2 kvartal Kvartalsrapport 1 kvartal Rapporter 2009 Årsrapport 2009 Kvartalsrapport 3 kvartal Kvartalsrapport 2 kvartal Kvartalsrapport 1 kvartal Rapporter 2008 Årsrapport 2008 Kvartalsrapport 3 kvartal Kvartalsrapport 2 kvartal Kvartalsrapport 1 kvartal Rapporter 2007 Årsrapport 2007 Kvartalsrapport 3 kvartal Kvartalsrapport 2 kvartal Kvartalsrapport 1 kvartal Rapporter 2006 Årsrapport 2006 Kvartalsrapport 3 kvartal Kvartalsrapport 2 kvartal Kvartalsrapport 1 kvartal Rapporter 2005 Årsrapport 2005 Kvartalsrapport 3 kvartal Kvartalsrapport 2 kvartal Kvartalsrapport 1 kvartal Rapporter 2004 Årsrapport 2004 Kvartalsrapport 3 kvartal Kvartalsrapport 2 kvartal Kvartalsrapport 1 kvartal Rapporter 2003 Årsrapport 2003 Kvartalsrapport 3 kvartalâ Rapporter 2002 Årsrapport 2002 Rapporter 2001 Årsrapport 2001 BesÃksadresse Ãvre StrandgateÂ 124 4005Â Stavanger Postadresse Postboks 300 Sentrum 4002 StavangerTelefonÂ Â 51Â 50Â 20Â 00 epost postpetorono faktura fakturapetorono Foretaksregisteret orgnr NOÂ 983Â 382Â 355 PersonvernerklÃring
